models/pretrained/landcover/flair-hub-rgb-swinbase-upernet/model_utils/FLAIR-HUB_LC-A_RGB_swinbase-upernet_metrics.json

{
    "Avg_metrics_name": [
        "mIoU",
        "Overall Accuracy",
        "F-score",
        "Precision",
        "Recall"
    ],
    "Avg_metrics": [
        64.05411691770314,
        76.78430129756099,
        76.88085787228218,
        77.71052550475211,
        76.58957237918774
    ],
    "classes": [
        "building",
        "greenhouse",
        "swimming_pool",
        "impervious surface",
        "pervious surface",
        "bare soil",
        "water",
        "snow",
        "herbaceous vegetation",
        "agricultural land",
        "plowed land",
        "vineyard",
        "deciduous",
        "coniferous",
        "brushwood"
    ],
    "per_class_iou": [
        83.76885983773445,
        77.89120964023834,
        58.500671688408026,
        75.0289593338368,
        56.971891754421556,
        65.21380065072387,
        90.08022514897407,
        67.76714191918819,
        52.85131642424674,
        56.52931659778343,
        37.34033325017101,
        78.87608105827285,
        70.0710996690139,
        58.94767594670296,
        30.973170845830783
    ],
    "per_class_fscore": [
        91.1676329838486,
        87.5717353294332,
        73.8175694339174,
        85.73319480318948,
        72.588654080251,
        78.94473753871377,
        94.7812694122961,
        80.78714478170103,
        69.15389106307096,
        72.22840784904307,
        54.37635451510675,
        88.19075260551713,
        82.40212452954522,
        74.17242887712158,
        47.29697028147768
    ],
    "per_class_precision": [
        91.4178203631318,
        85.27822859440057,
        77.36059053408597,
        87.12843908311126,
        70.1781084060501,
        74.63745493493803,
        94.99530230818701,
        97.53231834686889,
        71.8703686169958,
        68.13326939845126,
        51.25123338962131,
        86.89404576360974,
        81.00173417023383,
        79.78097927573943,
        48.19798938585674
    ],
    "per_class_recall": [
        90.91881126585324,
        89.99201656044002,
        70.58486818876318,
        84.38193212291874,
        75.1706897775003,
        83.77960831165906,
        94.56819881869258,
        68.94933894111414,
        66.63528352724737,
        76.8473017147693,
        57.90734187783791,
        89.5267468518002,
        83.85178775447835,
        69.30063947704292,
        46.429020497698744
    ]
}

models/pretrained/landcover/flair-hub-rgb-swinbase-upernet/README.md

---
license: etalab-2.0
pipeline_tag: image-segmentation
library_name: pytorch
tags:
- semantic segmentation
- pytorch
- landcover
model-index:
- name: FLAIR-HUB_LC-A_RVB_swinbase-upernet
  results:
  - task:
      type: semantic-segmentation
    dataset:
      name: IGNF/FLAIR-HUB/
      type: earth-observation-dataset
    metrics:
    - type: mIoU
      value: 64.054
      name: mIoU
    - type: OA
      value: 76.784
      name: Overall Accuracy
    - type: IoU
      value: 83.769
      name: IoU building
    - type: IoU
      value: 77.891
      name: IoU greenhouse
    - type: IoU
      value: 61.59
      name: IoU swimming pool
    - type: IoU
      value: 75.029
      name: IoU impervious surface
    - type: IoU
      value: 56.972
      name: IoU pervious surface
    - type: IoU
      value: 65.214
      name: IoU bare soil
    - type: IoU
      value: 90.08
      name: IoU water
    - type: IoU
      value: 67.767
      name: IoU snow
    - type: IoU
      value: 52.851
      name: IoU herbaceous vegetation
    - type: IoU
      value: 56.529
      name: IoU agricultural land
    - type: IoU
      value: 37.34
      name: IoU plowed land
    - type: IoU
      value: 78.876
      name: IoU vineyard
    - type: IoU
      value: 70.071
      name: IoU deciduous
    - type: IoU
      value: 58.948
      name: IoU coniferous
    - type: IoU
      value: 30.973
      name: IoU brushwood
---